{
  "$schema": "https://json-schema.org/draft/2020-12/schema",
  "$id": "https://github.com/cloudzero/cloudzero-claude-marketplace/blob/main/plugins/model-right-sizer/schemas/blueprint.schema.json",
  "title": "model-right-sizer Right-Sizing Blueprint (Pass A)",
  "description": "Strict output contract for the model-right-sizer agent's Pass A (the Right-Sizing Blueprint). The agent emits exactly one JSON object conforming to this schema instead of prose or markdown tables. See blueprint.example.json for a worked instance. additionalProperties is false at every level on purpose — an agent cannot reintroduce free-form fields.",
  "type": "object",
  "additionalProperties": false,
  "required": [
    "schema_version",
    "mode",
    "intent",
    "price_sheet",
    "blueprint_rows",
    "work_routing_map",
    "message_schemas",
    "uncertainty_ledger"
  ],
  "properties": {
    "schema_version": {
      "const": "1.2",
      "description": "Bump alongside this file and the plugin CHANGELOG when the shape changes. 1.2 is a fresh, independent addition of budget.real_work_signals (see $defs.budget) -- it makes no compatibility claim against any other schema_version 1.2 work on a sibling branch that hasn't merged into this history, the same disclaimer 1.1's own status-ledger addition carried."
    },
    "mode": {
      "enum": ["dry_run", "live_blueprint"],
      "description": "dry_run = produced by the model-right-sizer-dryrun skill against a hypothetical intent; live_blueprint = produced as the front bookend of a real build."
    },
    "intent": {
      "type": "string",
      "minLength": 1,
      "description": "The free-text task or build this blueprint was produced for."
    },
    "price_sheet": { "$ref": "#/$defs/priceSheet" },
    "blueprint_rows": {
      "type": "array",
      "minItems": 1,
      "items": { "$ref": "#/$defs/blueprintRow" },
      "description": "One row per decomposed stage/sub-agent this work will spend model tokens on. Carries the three-signal scoring."
    },
    "work_routing_map": {
      "type": "array",
      "items": { "$ref": "#/$defs/routingMapRow" },
      "description": "One row per execution/build unit — the 'who produces what' translation of the blueprint rows into dispatchable work. May be empty for a dry run with no build units yet decided."
    },
    "message_schemas": {
      "type": "array",
      "items": { "$ref": "#/$defs/messageSchema" },
      "description": "One entry per distinct handoff-seam shape, referenced by id from blueprint_rows[].handoff_schema_ref and work_routing_map[].handoff_schema_ref. Do not author one per pair of stages — share an entry across seams with the same shape."
    },
    "uncertainty_ledger": { "$ref": "#/$defs/uncertaintyLedger" }
  },
  "$defs": {
    "score": {
      "type": "object",
      "additionalProperties": false,
      "required": ["score", "reason"],
      "properties": {
        "score": { "type": "integer", "minimum": 0, "maximum": 100 },
        "reason": {
          "type": "string",
          "minLength": 1,
          "description": "One clause. Never a bare number."
        }
      }
    },
    "modelChoice": {
      "type": "object",
      "additionalProperties": false,
      "required": ["model", "confidence"],
      "properties": {
        "model": {
          "type": "string",
          "minLength": 1,
          "description": "A model ID from price_sheet.models[], the literal 'deterministic_query_layer' when the pick is to route via a deterministic query layer instead of a model, or 'local:<model-id>' for an open-weight model running on hardware the operator already owns. A local pick is a non-invoiced tier, not a free one: its price_sheet.models[] entry must carry cost_basis 'amortized_local' and a non-zero amortized rate."
        },
        "effort": {
          "enum": ["none", "low", "medium", "high", "xhigh", "max"],
          "description": "Omit (or 'none') when model is 'deterministic_query_layer' or the model has no effort dial."
        },
        "confidence": { "type": "integer", "minimum": 0, "maximum": 100 }
      }
    },
    "pick": {
      "type": "object",
      "additionalProperties": false,
      "required": ["primary", "runner_up", "what_flips_it"],
      "properties": {
        "primary": { "$ref": "#/$defs/modelChoice" },
        "runner_up": { "$ref": "#/$defs/modelChoice" },
        "what_flips_it": {
          "type": "string",
          "minLength": 1,
          "description": "The concrete condition that would flip primary and runner-up."
        },
        "why_not_tier_above": { "type": "string" },
        "why_not_tier_below": { "type": "string" }
      }
    },
    "realWorkSignal": {
      "type": "object",
      "additionalProperties": false,
      "required": ["value", "reason"],
      "properties": {
        "value": { "type": "number", "minimum": 0, "maximum": 1 },
        "reason": {
          "type": "string",
          "minLength": 1,
          "description": "One clause. Never a bare number -- same discipline as $defs.score."
        }
      }
    },
    "realWorkSignals": {
      "type": "object",
      "additionalProperties": false,
      "description": "The bounded [0.0, 1.0] inputs to eval/token_ceiling_formula.py's compute_token_ceiling()/compute_token_ceiling_additive() -- CODE derives token_ceiling from these, the agent never free-hands the integer. All six are rated on every row this applies to (see budget's own required-when rule below), even the three whose current default WEIGHT in the formula is 0.0 -- rating them anyway is how real calibration data for those signals gets collected for a future validation pass, per tuning/results/2026-08-22-signal-candidates-by-subagent-archetype.md. See that module's docstring for each signal's exact definition and 0.0/1.0 anchors.",
      "required": [
        "tool_call_volume",
        "content_volume",
        "cross_reference_load",
        "validation_loop_iterations",
        "context_ingestion_volume",
        "investigative_uncertainty"
      ],
      "properties": {
        "tool_call_volume": { "$ref": "#/$defs/realWorkSignal" },
        "content_volume": { "$ref": "#/$defs/realWorkSignal" },
        "cross_reference_load": { "$ref": "#/$defs/realWorkSignal" },
        "validation_loop_iterations": { "$ref": "#/$defs/realWorkSignal" },
        "context_ingestion_volume": { "$ref": "#/$defs/realWorkSignal" },
        "investigative_uncertainty": { "$ref": "#/$defs/realWorkSignal" }
      }
    },
    "budget": {
      "type": "object",
      "additionalProperties": false,
      "required": ["token_ceiling"],
      "description": "token_ceiling is always required and always an actual integer, never null or omitted -- use 0 for a row that spends no model tokens at all (e.g. routed entirely through a deterministic query layer). This is what keeps 'budget: {}' or 'budget: {token_ceiling: null}' from satisfying the schema despite Pass A's 'not a vibe' requirement. real_work_signals is required whenever token_ceiling is nonzero (the allOf below) -- a real model dispatch derives its ceiling from rated signals plus eval/token_ceiling_formula.py, it does not free-hand the integer; only a token_ceiling: 0 row (nothing dispatched to a model) may omit it.",
      "properties": {
        "token_ceiling": {
          "type": "integer",
          "minimum": 0,
          "description": "0 means explicitly zero model tokens (not 'unspecified')."
        },
        "real_work_signals": { "$ref": "#/$defs/realWorkSignals" },
        "thinking_budget": {
          "type": ["string", "null"],
          "description": "e.g. '<=8k thinking'. Null only for a stage with no effort dial at all, or 0 token_ceiling."
        },
        "warning_threshold_pct": {
          "type": "number",
          "exclusiveMinimum": 0,
          "maximum": 1,
          "default": 0.7,
          "description": "Fraction of token_ceiling at which the invoking session should warn the dispatched sub-agent to course-correct before it blows its ceiling. Optional -- omitting it means 'use the default of 0.7'."
        }
      },
      "allOf": [
        {
          "if": {
            "properties": { "token_ceiling": { "type": "integer", "exclusiveMinimum": 0 } },
            "required": ["token_ceiling"]
          },
          "then": { "required": ["real_work_signals"] }
        }
      ]
    },
    "blueprintRow": {
      "type": "object",
      "additionalProperties": false,
      "required": [
        "id",
        "name",
        "query_shaped",
        "signals",
        "pick",
        "budget",
        "handoff_schema_ref",
        "keep_or_override",
        "rationale"
      ],
      "properties": {
        "id": { "type": "string", "minLength": 1 },
        "name": { "type": "string", "minLength": 1 },
        "description": { "type": "string" },
        "query_shaped": {
          "type": "boolean",
          "description": "True if this stage is fundamentally a structured-data query/computation (lookup, join, aggregate, arithmetic) rather than open-ended reasoning."
        },
        "query_layer_note": {
          "type": ["string", "null"],
          "description": "Required-in-spirit when query_shaped is true: the deterministic-query-layer alternative and its expected token/reliability delta."
        },
        "loop_class": {
          "enum": ["single-shot", "low-tool-turn", "agentic", null],
          "description": "single-shot / low-tool-turn (<=2 tool turns) vs agentic (>=3 tool turns / unattended multi-tool). Governs whether a down-pin is safe to ship live or must be measurement-gated."
        },
        "signals": {
          "type": "object",
          "additionalProperties": false,
          "required": ["effectiveness", "efficiency", "difficulty"],
          "description": "The three pillars. All three are required on every row — none may be omitted or left as a bare number.",
          "properties": {
            "effectiveness": { "$ref": "#/$defs/score" },
            "efficiency": { "$ref": "#/$defs/score" },
            "difficulty": { "$ref": "#/$defs/score" }
          }
        },
        "pick": { "$ref": "#/$defs/pick" },
        "default_model": {
          "type": ["string", "null"],
          "description": "The consuming system's static default for this role/stage, if one exists. Null if there is none."
        },
        "keep_or_override": { "enum": ["keep", "override"] },
        "budget": { "$ref": "#/$defs/budget" },
        "handoff_schema_ref": {
          "type": "string",
          "minLength": 1,
          "description": "An id into message_schemas[], or the literal 'none' (terminal stage, nothing downstream to hand off to), or 'route_via_query_layer'."
        },
        "rationale": { "type": "string", "minLength": 1 }
      }
    },
    "routingMapRow": {
      "type": "object",
      "additionalProperties": false,
      "required": [
        "id",
        "build_unit",
        "pick",
        "budget",
        "handoff_schema_ref",
        "rationale",
        "status",
        "status_updated_at"
      ],
      "description": "allOf/if/then below enforces the status_updated_at <-> status coupling: null exactly while status is 'not_started', a real timestamp string once it isn't -- the same conditional-requirement idiom as budget.token_ceiling's own 'required, never a null stand-in for unset' rule above, expressed mechanically instead of only in prose.",
      "properties": {
        "id": { "type": "string", "minLength": 1, "maxLength": 64, "pattern": "^[A-Za-z0-9._-]+$" },
        "build_unit": {
          "type": "string",
          "minLength": 1,
          "description": "A short human-readable label for this unit of work (e.g. 'Slack bot: message-fetch + summarization module') -- free text by design, not an identifier, so it carries no pattern/maxLength constraint."
        },
        "derived_from_stage_id": {
          "type": ["string", "null"],
          "description": "blueprint_rows[].id this build unit was decomposed from, if traceable to one."
        },
        "pick": { "$ref": "#/$defs/pick" },
        "budget": { "$ref": "#/$defs/budget" },
        "handoff_schema_ref": { "type": "string", "minLength": 1 },
        "rationale": { "type": "string", "minLength": 1 },
        "status": {
          "enum": ["not_started", "dispatched", "in_progress", "done", "blocked"],
          "description": "Every row is emitted 'not_started' at blueprint time; the orchestrator updates it as dispatch proceeds."
        },
        "status_updated_at": {
          "type": ["string", "null"],
          "description": "ISO-8601 timestamp of the last status transition. Null while status is 'not_started'; required (non-null) once status leaves 'not_started' -- see this $def's own description for the enforcing allOf/if/then."
        },
        "status_note": {
          "type": "string",
          "minLength": 1,
          "description": "Optional. Names the concrete reason when status is 'blocked'; also available for 'done' at authoring discretion."
        }
      },
      "allOf": [
        {
          "if": {
            "properties": { "status": { "const": "not_started" } },
            "required": ["status"]
          },
          "then": {
            "properties": { "status_updated_at": { "const": null } }
          }
        },
        {
          "if": {
            "properties": {
              "status": { "enum": ["dispatched", "in_progress", "done", "blocked"] }
            },
            "required": ["status"]
          },
          "then": {
            "properties": { "status_updated_at": { "type": "string", "minLength": 1 } },
            "required": ["status_updated_at"]
          }
        }
      ]
    },
    "messageSchema": {
      "type": "object",
      "additionalProperties": false,
      "required": ["id", "seam_description", "fields", "exclude"],
      "properties": {
        "id": { "type": "string", "minLength": 1 },
        "seam_description": {
          "type": "string",
          "minLength": 1,
          "description": "e.g. 'build stage -> review stage' or 'finder -> verifier fan-out'."
        },
        "fields": {
          "type": "array",
          "items": {
            "type": "object",
            "additionalProperties": false,
            "required": ["name", "type"],
            "properties": {
              "name": { "type": "string" },
              "type": { "type": "string" },
              "description": { "type": "string" }
            }
          }
        },
        "exclude": {
          "type": "array",
          "items": { "type": "string" },
          "description": "What this handoff must NOT carry, e.g. 'full transcript', 'raw retrieved rows', 'chain-of-thought', 'tool call logs'."
        }
      }
    },
    "priceSheet": {
      "type": "object",
      "additionalProperties": false,
      "required": ["source", "models"],
      "properties": {
        "source": {
          "enum": ["delegated_fetch", "direct_fetch", "fallback_snapshot"],
          "description": "delegated_fetch = a sub-agent dispatch fetched live pricing; direct_fetch = this agent fetched it itself; fallback_snapshot = live retrieval failed, figures are the illustrative snapshot and unverified this run."
        },
        "models": {
          "type": "array",
          "items": {
            "type": "object",
            "additionalProperties": false,
            "required": ["name", "id", "in_per_1m", "out_per_1m"],
            "properties": {
              "name": { "type": "string" },
              "id": { "type": "string" },
              "in_per_1m": { "type": "number" },
              "out_per_1m": { "type": "number" },
              "context_tokens": { "type": ["integer", "null"] },
              "max_output_tokens": { "type": ["integer", "null"] },
              "effort_ceiling": { "type": ["string", "null"] },
              "cost_basis": {
                "enum": ["provider_list_price", "amortized_local"],
                "description": "How in_per_1m/out_per_1m were derived. Absent means provider_list_price: a vendor's published per-token rate. 'amortized_local' marks a non-invoiced tier (an open-weight model on hardware the operator already owns), whose rate is the operator's own device amortization plus power over measured throughput. It is never 0: a tier booked at zero makes every stage moved onto it show unbounded ROI, and poisons any calibration history that reads the result."
              },
              "cost_basis_note": {
                "type": ["string", "null"],
                "description": "Required in spirit when cost_basis is 'amortized_local': the derivation behind the rate (device amortization, power draw, measured tokens/hour, and whether the device cost is charged at all), so a reader can tell an owned-hardware figure from an invoiced one. See plugins/model-right-sizer/eval/local_tier.py for the formulas."
              }
            }
          }
        }
      }
    },
    "uncertaintyLedger": {
      "type": "object",
      "additionalProperties": false,
      "required": ["assumptions", "price_sheet_freshness", "would_measure"],
      "properties": {
        "assumptions": { "type": "array", "items": { "type": "string" } },
        "price_sheet_freshness": {
          "enum": ["verified_this_run", "unverified", "stale_fallback"]
        },
        "would_measure": {
          "type": "array",
          "items": { "type": "string" },
          "description": "The 2-3 things that would sharpen the next blueprint."
        },
        "calibration": {
          "type": "object",
          "additionalProperties": false,
          "properties": {
            "ledger_found": {
              "type": "boolean",
              "description": "Whether a recommended-vs-actual calibration history was available and consulted."
            },
            "adjusted_row_ids": {
              "type": "array",
              "items": { "type": "string" },
              "description": "blueprint_rows[].id / work_routing_map[].id values whose pick changed because of the calibration history."
            },
            "notes": { "type": "string" }
          }
        }
      }
    }
  }
}
